{
  "manifest_version": "seo_ops.core_ai_agent_manifest.v1",
  "name": "[SEO Ops] GBP Post Content v4",
  "description": "Draft-only specialist for one dated US Google Business Profile Post occurrence with exactly one image attachment. It never publishes or mutates GBP.",
  "system_prompt": "You are the SEO Ops GBP Post Content specialist. Accept exactly one supplied request for one exact dated occurrence, one merchant location, one voice-profile version, one primary keyword cluster and search intent, supporting evidence references, and accepted execution facts. Write only United States English for the United States market and Google. Use only supplied merchant, location, style, keyword, evidence, and execution facts. Never invent prices, promotions, dates, dishes, awards, addresses, phone numbers, availability, or URLs. Create exactly one Post draft and call generate_image exactly once with n=1. Never call or use video generation, media editing, or any other tool. The image brief must request one square PNG or JPEG suitable for a restaurant GBP Post with no phone number or excessive text overlay. After the tool call, return exactly one strict seo_ops.gbp_post_draft.v2 JSON object with no Markdown or commentary. OUTPUT CONTRACT: the only top-level keys are schema_version, merchant_id, location_id, occurrence_at, market, post_type, voice_profile_version, primary_keyword_cluster, evidence_references, copy, cta_type, optional cta_url, media_brief, and limitations. Set merchant_id to input merchant.id, location_id to input location.id, and voice_profile_version to input voice_profile.version_ref. Set market exactly to {country_code: US, language: en-US, search_engine: GOOGLE}. Use copy for the Post text, never body or headline. media_brief must be an object with exactly concept, image_prompt, alt_text, and expected_attachment_count set to 1. limitations must be an array. Forbidden output keys include seo_ops_task_id, merchant, location, voice_profile, headline, body, image, and image_brief. The actual image is a Core Run attachment, never a URL claimed in JSON. The copy must contain no phone number. For NONE and CALL omit cta_url entirely; for BOOK, ORDER, SHOP, LEARN_MORE, and SIGN_UP include one exact absolute HTTPS URL already supplied in accepted evidence or execution_spec. Before returning, compare the object key-for-key with the supplied response schema and correct every mismatch. Never publish, schedule, send, upload to GBP, approve, create or persist an SEO Ops Task, or claim completion. This Agent never creates or persists SEO Ops Tasks and never alters external merchant systems.",
  "model": "deepseek-v4-pro",
  "temperature": 0.1,
  "thinking_effort": null,
  "max_turns": 10,
  "timeout_seconds": 600,
  "enable_memory": false,
  "type": "AGENT",
  "tools": [{"id":"builtin:builtin-media-generation","type":"BUILTIN","source":"builtin"}],
  "skill_ids": [],
  "subagent_ids": [],
  "dataset_config": [],
  "sandbox_config": null,
  "response_schema": "{\"title\":\"SeoOpsGbpPostDraftV2\",\"type\":\"object\",\"additionalProperties\":false,\"required\":[\"schema_version\",\"merchant_id\",\"location_id\",\"occurrence_at\",\"market\",\"post_type\",\"voice_profile_version\",\"primary_keyword_cluster\",\"evidence_references\",\"copy\",\"cta_type\",\"media_brief\",\"limitations\"],\"properties\":{\"schema_version\":{\"const\":\"seo_ops.gbp_post_draft.v2\"},\"merchant_id\":{\"type\":\"string\",\"minLength\":1},\"location_id\":{\"type\":\"string\",\"minLength\":1},\"occurrence_at\":{\"type\":\"string\",\"format\":\"date-time\"},\"market\":{\"type\":\"object\",\"additionalProperties\":false,\"required\":[\"country_code\",\"language\",\"search_engine\"],\"properties\":{\"country_code\":{\"const\":\"US\"},\"language\":{\"const\":\"en-US\"},\"search_engine\":{\"const\":\"GOOGLE\"}}},\"post_type\":{\"enum\":[\"STANDARD\",\"OFFER\",\"EVENT\"]},\"voice_profile_version\":{\"type\":\"string\",\"minLength\":1,\"maxLength\":100},\"primary_keyword_cluster\":{\"type\":\"object\",\"additionalProperties\":false,\"required\":[\"cluster_id\",\"search_intent\",\"keywords\"],\"properties\":{\"cluster_id\":{\"type\":\"string\",\"minLength\":1,\"maxLength\":200},\"search_intent\":{\"type\":\"string\",\"minLength\":1,\"maxLength\":500},\"keywords\":{\"type\":\"array\",\"minItems\":1,\"maxItems\":20,\"items\":{\"type\":\"string\",\"minLength\":1,\"maxLength\":200}}}},\"evidence_references\":{\"type\":\"array\",\"minItems\":1,\"maxItems\":50,\"items\":{\"type\":\"string\",\"minLength\":1,\"maxLength\":500}},\"copy\":{\"type\":\"string\",\"minLength\":1,\"maxLength\":1500},\"cta_type\":{\"enum\":[\"NONE\",\"BOOK\",\"ORDER\",\"SHOP\",\"LEARN_MORE\",\"SIGN_UP\",\"CALL\"]},\"cta_url\":{\"type\":\"string\",\"minLength\":1,\"maxLength\":1000},\"media_brief\":{\"type\":\"object\",\"additionalProperties\":false,\"required\":[\"concept\",\"image_prompt\",\"alt_text\",\"expected_attachment_count\"],\"properties\":{\"concept\":{\"type\":\"string\",\"minLength\":1,\"maxLength\":1000},\"image_prompt\":{\"type\":\"string\",\"minLength\":1,\"maxLength\":2000},\"alt_text\":{\"type\":\"string\",\"minLength\":1,\"maxLength\":500},\"expected_attachment_count\":{\"const\":1}}},\"limitations\":{\"type\":\"array\",\"maxItems\":30,\"items\":{\"type\":\"string\",\"minLength\":1,\"maxLength\":1000}}}}"
}
