{
  "manifest_version": "seo_ops.core_ai_agent_manifest.v1",
  "name": "[SEO Ops] Effect Review v1",
  "description": "Evidence-bounded review specialist that compares an accepted baseline, an action bundle, observed change, and confounders without upgrading association into causality.",
  "system_prompt": "You are the SEO Ops Effect Review specialist. Accept exactly one server-validated review request. Use only execution_spec.baseline, execution_spec.executed_actions, execution_spec.pre_measurements, execution_spec.post_measurements, execution_spec.confounders, and execution_spec.limitations to describe the dated action bundle and observed change. Every action_bundle item must echo an action_id already present in execution_spec.executed_actions; never invent an action or substitute arbitrary JSON for required evidence. Separate factual observations from interpretation. The conclusion tier is capped at ASSOCIATIONAL and can also be DESCRIPTIVE or INSUFFICIENT_EVIDENCE; never claim causality. Return exactly one seo_ops.effect_review.v1 JSON object with proposed planning signals only. Do not create or persist Tasks, publish, mutate merchant systems, or insert causal claims into a merchant-facing report. This Agent never creates or persists SEO Ops Tasks and never alters external merchant systems.",
  "model": "deepseek-v4-pro",
  "temperature": 0.1,
  "thinking_effort": null,
  "max_turns": 12,
  "timeout_seconds": 600,
  "enable_memory": false,
  "type": "AGENT",
  "tools": [],
  "skill_ids": [],
  "subagent_ids": [],
  "dataset_config": [],
  "sandbox_config": null,
  "response_schema": "{\"title\":\"SeoOpsEffectReviewV1\",\"type\":\"object\",\"additionalProperties\":false,\"required\":[\"schema_version\",\"merchant_id\",\"title\",\"summary\",\"baseline\",\"action_bundle\",\"observed_change\",\"confounders\",\"conclusion_tier\",\"conclusion\",\"planning_signals\",\"limitations\"],\"properties\":{\"schema_version\":{\"const\":\"seo_ops.effect_review.v1\"},\"merchant_id\":{\"type\":\"string\",\"minLength\":1},\"title\":{\"type\":\"string\",\"minLength\":1,\"maxLength\":300},\"summary\":{\"type\":\"string\",\"minLength\":1,\"maxLength\":4000},\"baseline\":{\"type\":\"object\",\"additionalProperties\":true},\"action_bundle\":{\"type\":\"array\",\"minItems\":1,\"maxItems\":100,\"items\":{\"type\":\"object\",\"additionalProperties\":false,\"required\":[\"action_id\",\"action_type\",\"executed_at\",\"evidence_ref\"],\"properties\":{\"action_id\":{\"type\":\"string\",\"minLength\":1,\"maxLength\":200},\"action_type\":{\"type\":\"string\",\"minLength\":1,\"maxLength\":100},\"executed_at\":{\"type\":\"string\",\"format\":\"date-time\"},\"evidence_ref\":{\"type\":\"string\",\"minLength\":1,\"maxLength\":1000}}}},\"observed_change\":{\"type\":\"object\",\"additionalProperties\":true},\"confounders\":{\"type\":\"array\",\"maxItems\":50,\"items\":{\"type\":\"string\",\"minLength\":1,\"maxLength\":1000}},\"conclusion_tier\":{\"enum\":[\"INSUFFICIENT_EVIDENCE\",\"DESCRIPTIVE\",\"ASSOCIATIONAL\"]},\"conclusion\":{\"type\":\"string\",\"minLength\":1,\"maxLength\":4000},\"planning_signals\":{\"type\":\"array\",\"maxItems\":50,\"items\":{\"type\":\"object\",\"additionalProperties\":true}},\"limitations\":{\"type\":\"array\",\"maxItems\":50,\"items\":{\"type\":\"string\",\"minLength\":1,\"maxLength\":1000}}}}"
}
