{
  "name": "[SEO Ops] Execution Plan v1",
  "description": "UAT specialist Agent for Connexup SEO Ops. It turns persisted keyword and audit artifacts into a strict dependency-aware plan without creating tasks.",
  "model": "deepseek-v4-pro",
  "temperature": 0.1,
  "max_turns": 12,
  "timeout_seconds": 600,
  "enable_memory": false,
  "type": "AGENT",
  "tools": [],
  "skill_ids": [
    "6a8ec15f225bdefec335aefa"
  ],
  "system_prompt": "You are the SEO Ops Execution Plan specialist. Accept exactly one seo_ops.plan_request.v1 JSON object and follow the attached seo-ops-execution-plan Skill. Require both a persisted KEYWORD_SET and AUDIT_REPORT in upstream_artifacts. Use only supplied confirmed facts and accepted upstream artifacts. Echo merchant.id exactly as merchant_id. Order prerequisites before dependents and make acceptance criteria independently checkable. External-write work is only a proposal inside the artifact. Return exactly one seo_ops.execution_plan.v1 JSON object with no Markdown, code fences, attachments, or commentary. Never claim task creation, approval, execution, persistence, publication, or verification. This Agent never creates or persists SEO Ops Tasks and never alters external merchant systems.",
  "response_schema": "{\"$schema\":\"https://json-schema.org/draft/2020-12/schema\",\"title\":\"SeoOpsExecutionPlanV1\",\"type\":\"object\",\"additionalProperties\":false,\"required\":[\"schema_version\",\"merchant_id\",\"title\",\"summary\",\"horizon_days\",\"objectives\",\"work_items\",\"review_cadence\",\"assumptions\"],\"properties\":{\"schema_version\":{\"const\":\"seo_ops.execution_plan.v1\"},\"merchant_id\":{\"type\":\"string\",\"minLength\":1},\"title\":{\"type\":\"string\",\"minLength\":1,\"maxLength\":300},\"summary\":{\"type\":\"string\",\"minLength\":1,\"maxLength\":4000},\"horizon_days\":{\"type\":\"integer\",\"minimum\":1,\"maximum\":365},\"objectives\":{\"type\":\"array\",\"minItems\":1,\"maxItems\":20,\"items\":{\"type\":\"string\",\"minLength\":1,\"maxLength\":1000}},\"work_items\":{\"type\":\"array\",\"minItems\":1,\"maxItems\":100,\"items\":{\"type\":\"object\",\"additionalProperties\":false,\"required\":[\"id\",\"title\",\"task_type\",\"execution_mode\",\"priority\",\"depends_on\",\"rationale\",\"acceptance_criteria\"],\"properties\":{\"id\":{\"type\":\"string\",\"pattern\":\"^[a-z0-9][a-z0-9_-]{0,99}$\"},\"title\":{\"type\":\"string\",\"minLength\":1,\"maxLength\":300},\"task_type\":{\"enum\":[\"PLANNER\",\"QUESTIONNAIRE\",\"KEYWORD_RESEARCH\",\"KEYWORD_WEEKLY\",\"AUDIT\",\"REPORT\",\"PLAN\",\"GBP_POST\",\"GBP_UPDATE\",\"WEBSITE_CONTENT\",\"REVIEW\",\"MANUAL_FOLLOWUP\"]},\"execution_mode\":{\"enum\":[\"AUTO_WRITE\",\"ARTIFACT\",\"READ_ONLY\",\"MANUAL\"]},\"priority\":{\"enum\":[\"LOW\",\"MEDIUM\",\"HIGH\",\"URGENT\"]},\"depends_on\":{\"type\":\"array\",\"maxItems\":20,\"items\":{\"type\":\"string\",\"pattern\":\"^[a-z0-9][a-z0-9_-]{0,99}$\"}},\"rationale\":{\"type\":\"string\",\"minLength\":1,\"maxLength\":2000},\"acceptance_criteria\":{\"type\":\"string\",\"minLength\":1,\"maxLength\":2000},\"due_offset_days\":{\"type\":\"integer\",\"minimum\":0,\"maximum\":365}}}},\"review_cadence\":{\"type\":\"string\",\"minLength\":1,\"maxLength\":1000},\"assumptions\":{\"type\":\"array\",\"maxItems\":50,\"items\":{\"type\":\"string\",\"minLength\":1,\"maxLength\":1000}}}}",
  "manifest_version": "seo_ops.core_ai_agent_manifest.v1",
  "thinking_effort": null,
  "subagent_ids": [],
  "dataset_config": [],
  "sandbox_config": null
}
