{
  "name": "[SEO Ops] Evidence Audit v1",
  "description": "UAT specialist Agent for Connexup SEO Ops. It audits supplied confirmed facts, keyword scope, and allowed public surfaces, then returns strict evidence-bounded JSON.",
  "model": "deepseek-v4-pro",
  "temperature": 0.1,
  "max_turns": 20,
  "timeout_seconds": 600,
  "enable_memory": false,
  "type": "AGENT",
  "tools": [
    {
      "id": "builtin:builtin-web",
      "type": "BUILTIN",
      "source": "builtin"
    },
    {
      "id": "6a0a7e45eb39b5c74eac135e",
      "type": "MCP"
    }
  ],
  "skill_ids": [
    "6a8ec15fccb92906b8117ccf"
  ],
  "system_prompt": "You are the SEO Ops evidence-bounded Local SEO Audit specialist. Accept exactly one seo_ops.audit_request.v1 JSON object and follow the attached seo-ops-audit-report Skill. Require a persisted KEYWORD_SET in upstream_artifacts. Use the supplied filled questionnaire as confirmed facts. You may inspect only supplied public URLs with the attached read-only web and PageSpeed capabilities. Never imply GBP, Search Console, analytics, POS, or CMS access unless the request supplies it and you actually use it. Echo merchant.id exactly as merchant_id. Return exactly one seo_ops.audit_report.v1 JSON object with no Markdown, code fences, attachments, or commentary. Record access and measurement gaps in limitations. Never claim persistence, task completion, or external changes. This Agent never creates or persists SEO Ops Tasks and never alters external merchant systems.",
  "response_schema": "{\"title\":\"SeoOpsAuditReportV1\",\"type\":\"object\",\"additionalProperties\":false,\"required\":[\"schema_version\",\"merchant_id\",\"title\",\"summary\",\"evidence_mode\",\"findings\",\"limitations\",\"next_actions\"],\"properties\":{\"schema_version\":{\"const\":\"seo_ops.audit_report.v1\"},\"merchant_id\":{\"type\":\"string\",\"minLength\":1},\"title\":{\"type\":\"string\",\"minLength\":1,\"maxLength\":300},\"summary\":{\"type\":\"string\",\"minLength\":1,\"maxLength\":4000},\"evidence_mode\":{\"enum\":[\"PUBLIC_AND_CONFIRMED\",\"CONNECTED_AND_CONFIRMED\",\"CONFIRMED_FACTS_ONLY\"]},\"findings\":{\"type\":\"array\",\"minItems\":1,\"maxItems\":100,\"items\":{\"type\":\"object\",\"additionalProperties\":false,\"required\":[\"id\",\"area\",\"severity\",\"observation\",\"evidence\",\"recommendation\"],\"properties\":{\"id\":{\"type\":\"string\",\"pattern\":\"^[a-z0-9][a-z0-9_-]{0,99}$\"},\"area\":{\"enum\":[\"GBP\",\"WEBSITE\",\"LOCAL_CONTENT\",\"TECHNICAL\",\"CITATIONS\",\"REVIEWS\",\"ANALYTICS\",\"OTHER\"]},\"severity\":{\"enum\":[\"CRITICAL\",\"HIGH\",\"MEDIUM\",\"LOW\",\"INFO\"]},\"observation\":{\"type\":\"string\",\"minLength\":1,\"maxLength\":2000},\"evidence\":{\"type\":\"array\",\"maxItems\":10,\"items\":{\"type\":\"string\",\"minLength\":1,\"maxLength\":1000}},\"recommendation\":{\"type\":\"string\",\"minLength\":1,\"maxLength\":2000}}}},\"limitations\":{\"type\":\"array\",\"maxItems\":50,\"items\":{\"type\":\"string\",\"minLength\":1,\"maxLength\":1000}},\"next_actions\":{\"type\":\"array\",\"minItems\":1,\"maxItems\":50,\"items\":{\"type\":\"string\",\"minLength\":1,\"maxLength\":1000}}}}",
  "manifest_version": "seo_ops.core_ai_agent_manifest.v1",
  "thinking_effort": null,
  "subagent_ids": [],
  "dataset_config": [],
  "sandbox_config": null
}
