{
  "manifest_version": "seo_ops.core_ai_agent_manifest.v1",
  "name": "[SEO Ops] GBP Post Content v1",
  "description": "Draft-only specialist for one dated US Google Business Profile Post occurrence. It creates reviewable copy and a media brief without publishing or claiming publication.",
  "system_prompt": "You are the SEO Ops GBP Post Content specialist. Accept exactly one supplied request for one exact dated occurrence, one merchant location, one voice-profile version, one primary keyword cluster and search intent, and supporting evidence references. Write only United States English suitable for United States search behavior. Use confirmed facts and supplied accepted artifacts only; record missing evidence in limitations. Return exactly one seo_ops.gbp_post_draft.v1 JSON object with no Markdown, attachments, or commentary. Never publish, schedule, send, upload, mutate GBP, claim publication, create or persist an SEO Ops Task, approve work, or claim completion. This Agent never creates or persists SEO Ops Tasks and never alters external merchant systems.",
  "model": "deepseek-v4-pro",
  "temperature": 0.1,
  "thinking_effort": null,
  "max_turns": 10,
  "timeout_seconds": 600,
  "enable_memory": false,
  "type": "AGENT",
  "tools": [],
  "skill_ids": [],
  "subagent_ids": [],
  "dataset_config": [],
  "sandbox_config": null,
  "response_schema": "{\"title\":\"SeoOpsGbpPostDraftV1\",\"type\":\"object\",\"additionalProperties\":false,\"required\":[\"schema_version\",\"merchant_id\",\"location_id\",\"occurrence_at\",\"market\",\"post_type\",\"voice_profile_version\",\"primary_keyword_cluster\",\"evidence_references\",\"copy\",\"media_brief\",\"limitations\"],\"properties\":{\"schema_version\":{\"const\":\"seo_ops.gbp_post_draft.v1\"},\"merchant_id\":{\"type\":\"string\",\"minLength\":1},\"location_id\":{\"type\":\"string\",\"minLength\":1},\"occurrence_at\":{\"type\":\"string\",\"format\":\"date-time\"},\"market\":{\"type\":\"object\",\"additionalProperties\":false,\"required\":[\"country_code\",\"language\",\"search_engine\"],\"properties\":{\"country_code\":{\"const\":\"US\"},\"language\":{\"const\":\"en-US\"},\"search_engine\":{\"const\":\"GOOGLE\"}}},\"post_type\":{\"enum\":[\"STANDARD\",\"OFFER\",\"EVENT\"]},\"voice_profile_version\":{\"type\":\"string\",\"minLength\":1,\"maxLength\":100},\"primary_keyword_cluster\":{\"type\":\"object\",\"additionalProperties\":false,\"required\":[\"cluster_id\",\"search_intent\",\"keywords\"],\"properties\":{\"cluster_id\":{\"type\":\"string\",\"minLength\":1,\"maxLength\":200},\"search_intent\":{\"type\":\"string\",\"minLength\":1,\"maxLength\":500},\"keywords\":{\"type\":\"array\",\"minItems\":1,\"maxItems\":20,\"items\":{\"type\":\"string\",\"minLength\":1,\"maxLength\":200}}}},\"evidence_references\":{\"type\":\"array\",\"minItems\":1,\"maxItems\":50,\"items\":{\"type\":\"string\",\"minLength\":1,\"maxLength\":500}},\"copy\":{\"type\":\"string\",\"minLength\":1,\"maxLength\":1500},\"media_brief\":{\"type\":\"object\",\"additionalProperties\":false,\"required\":[\"concept\",\"alt_text\"],\"properties\":{\"concept\":{\"type\":\"string\",\"minLength\":1,\"maxLength\":1000},\"alt_text\":{\"type\":\"string\",\"minLength\":1,\"maxLength\":500}}},\"limitations\":{\"type\":\"array\",\"maxItems\":30,\"items\":{\"type\":\"string\",\"minLength\":1,\"maxLength\":1000}}}}"
}
