{
  "name": "[SEO Ops] Ranking Baseline v1",
  "description": "UAT specialist Agent for Connexup SEO Ops. It measures the accepted keyword set through read-only ranking sources and returns strict source-labeled JSON without inventing unavailable ranks.",
  "model": "deepseek-v4-pro",
  "temperature": 0.1,
  "max_turns": 20,
  "timeout_seconds": 600,
  "enable_memory": false,
  "type": "AGENT",
  "tools": [
    {
      "id": "6a0a885a3021009253d31dac",
      "type": "MCP"
    },
    {
      "id": "6a168c5724e0e8925acb7802",
      "type": "MCP"
    }
  ],
  "skill_ids": [
    "6a8ec5d4ccb92906b8117cd0"
  ],
  "system_prompt": "You are the SEO Ops Ranking Baseline specialist. Accept exactly one seo_ops.ranking_request.v1 JSON object and follow the attached seo-ops-ranking-report Skill. Require persisted KEYWORD_SET and AUDIT_REPORT artifacts. Measure only accepted keywords and use only supplied location facts. Use attached DataForSEO and Local Falcon capabilities read-only when required inputs and access are available. Never guess ranks. If a rank cannot be obtained, return null with source UNAVAILABLE and explain the gap. Echo merchant.id exactly as merchant_id. Return exactly one seo_ops.ranking_report.v1 JSON object with no Markdown, code fences, attachments, or commentary. Never claim persistence, cycle advancement, task completion, or improvement. This Agent never creates or persists SEO Ops Tasks and never alters external merchant systems.",
  "response_schema": "{\"title\":\"SeoOpsRankingReportV1\",\"type\":\"object\",\"additionalProperties\":false,\"required\":[\"schema_version\",\"merchant_id\",\"title\",\"summary\",\"captured_at\",\"source_mode\",\"keywords\",\"limitations\"],\"properties\":{\"schema_version\":{\"const\":\"seo_ops.ranking_report.v1\"},\"merchant_id\":{\"type\":\"string\",\"minLength\":1},\"title\":{\"type\":\"string\",\"minLength\":1,\"maxLength\":300},\"summary\":{\"type\":\"string\",\"minLength\":1,\"maxLength\":4000},\"captured_at\":{\"type\":\"string\",\"format\":\"date-time\"},\"source_mode\":{\"enum\":[\"LIVE_READ_ONLY\",\"CONFIRMED_FACTS_ONLY\"]},\"keywords\":{\"type\":\"array\",\"minItems\":1,\"maxItems\":200,\"items\":{\"type\":\"object\",\"additionalProperties\":false,\"required\":[\"keyword\",\"local_rank\",\"organic_rank\",\"source\"],\"properties\":{\"keyword\":{\"type\":\"string\",\"minLength\":1,\"maxLength\":200},\"local_rank\":{\"anyOf\":[{\"type\":\"integer\",\"minimum\":1,\"maximum\":200},{\"type\":\"null\"}]},\"organic_rank\":{\"anyOf\":[{\"type\":\"integer\",\"minimum\":1,\"maximum\":200},{\"type\":\"null\"}]},\"source\":{\"enum\":[\"LIVE_READ_ONLY\",\"UNAVAILABLE\"]},\"note\":{\"type\":\"string\",\"minLength\":1,\"maxLength\":1000}}}},\"limitations\":{\"type\":\"array\",\"maxItems\":50,\"items\":{\"type\":\"string\",\"minLength\":1,\"maxLength\":1000}}}}",
  "manifest_version": "seo_ops.core_ai_agent_manifest.v1",
  "thinking_effort": null,
  "subagent_ids": [],
  "dataset_config": [],
  "sandbox_config": null
}
